question,answer
What is a dropout rate?,The dropout rate is a hyperparameter used in neural network training that determines the probability of dropping out a neuron during training. A higher dropout rate can improve the generalization and robustness of the network.
What is the difference between a validation set and a test set?,A validation set is a subset of the training data that is used to evaluate the performance of the model during training and select the best hyperparameters. A test set is a separate dataset that is used to evaluate the final performance of the model.
What is the difference between a regression problem and a classification problem?,"In a regression problem, the goal is to predict a continuous output variable. In a classification problem, the goal is to predict the class label of the input data."
What is a loss curve?,"A loss curve is a plot of the training loss and validation loss over the course of the training process. It can be used to diagnose problems with the training process, such as overfitting or underfitting."
What is underfitting?,Underfitting occurs when a neural network is not able to capture the complex patterns in the training data. This can occur when the network is too simple or the data is too noisy or complex.
What is overfitting?,Overfitting occurs when a neural network is too complex and memorizes the training data instead of generalizing to new data. This can occur when the network has too many parameters or when the training data is too small.
What is the bias-variance tradeoff?,The bias-variance tradeoff is the tradeoff between the error due to bias (underfitting) and the error due to variance (overfitting) in a machine learning model. A balance must be struck between the two to achieve the best performance.
What is a learning curve?,A learning curve is a plot of the training or validation error as a function of the size of the training dataset. It can be used to diagnose problems with the model or to determine the optimal dataset size.
What is online learning?,Online learning is a type of machine learning where the algorithm updates its parameters as new data becomes available in a streaming fashion. This is useful in scenarios where the data is constantly changing or where the amount of data is too large to store.
What is a multilayer perceptron?,A multilayer perceptron is a type of feedforward neural network that has one or more hidden layers between the input and output layer. It is one of the simplest types of neural networks.
What is a recurrent neural network?,A recurrent neural network is a type of neural network that is designed to process sequential input data. It has feedback connections that enable it to retain information from previous time steps.
What is a long short-term memory (LSTM) network?,A long short-term memory (LSTM) network is a type of recurrent neural network that is designed to solve the problem of vanishing gradients. It has specialized memory cells that can store information over long periods of time.
What is a gated recurrent unit (GRU)?,A gated recurrent unit (GRU) is a variant of a recurrent neural network that is similar to an LSTM network but with fewer parameters. It is particularly useful for processing sequences of variable length.
What is a transformer network?,"A transformer network is a type of neural network that is used for sequence-to-sequence tasks, such as machine translation. It uses self-attention mechanisms to learn representations of the input and output sequences."
What is attention?,"Attention is a mechanism used in neural networks to selectively focus on certain parts of the input or output data. It has been particularly successful in natural language processing tasks, such as machine translation and summarization."
What is transfer learning in natural language processing?,"Transfer learning in natural language processing is a technique where a pre-trained language model is used as a starting point for a new task, such as sentiment analysis or question answering. The pre-trained model is fine-tuned on the new task-specific dataset."
What is word embedding?,Word embedding is a technique used to represent words as numerical vectors in a neural network. It allows the network to learn semantic relationships between words and can improve the performance of natural language processing tasks.
What is attention in natural language processing?,Attention in natural language processing is a mechanism used to selectively focus on certain parts of the input or output sequence during the processing of natural language data. It has been particularly successful in machine translation and summarization.
What is a transformer encoder?,A transformer encoder is a component of a transformer network that is responsible for processing the input sequence and creating a representation that can be used by the decoder.
What is a transformer decoder?,A transformer decoder is a component of a transformer network that is responsible for generating the output sequence based on the encoded input sequence.
What is sequence-to-sequence learning?,"Sequence-to-sequence learning is a type of machine learning where the goal is to map one sequence to another sequence. It is commonly used in natural language processing tasks, such as machine translation and summarization."
What is a beam search?,A beam search is a technique used in sequence generation tasks to find the output sequence that has the highest probability. It works by keeping track of the top k candidate sequences at each time step.
What is a language model?,"A language model is a statistical model that is trained to predict the probability of a sequence of words. It can be used in natural language processing tasks, such as text generation and machine translation."
What is a generative model?,A generative model is a type of machine learning model that is used to generate new data samples that are similar to the training data. It is commonly used in image and text generation tasks.
What is a discriminative model?,"A discriminative model is a type of machine learning model that is used to classify or predict the output of an input data sample. It is commonly used in classification tasks, such as image and speech recognition."
What is a convolutional autoencoder?,A convolutional autoencoder is a type of autoencoder that is designed to process image data. It uses convolutional layers to encode the input image into a compressed representation and then uses deconvolutional layers to decode the compressed representation back into the original image.
What is a variational autoencoder?,A variational autoencoder is a type of autoencoder that is designed to generate new data samples from a latent space representation. It uses a probabilistic model to learn the distribution of the latent space and can generate new samples by sampling from this distribution.
What is a conditional generative model?,A conditional generative model is a type of generative model that is designed to generate new data samples based on a given condition. It is commonly used in tasks such as image and text generation.
What is reinforcement learning in robotics?,Reinforcement learning in robotics is a technique where a robot learns to perform tasks through trial and error by receiving feedback in the form of rewards or punishments. It can be used to train robots to perform complex tasks such as object manipulation and navigation.
What is a policy?,A policy is a strategy used by a reinforcement learning agent to select actions in a given state. It maps states to actions and is learned through trial and error.
What is Q-learning?,Q-learning is a reinforcement learning algorithm that is used to find an optimal policy for a given task. It involves iteratively updating a Q-value table that stores the expected rewards for each state-action pair.
What is the actor-critic algorithm?,"The actor-critic algorithm is a reinforcement learning algorithm that combines an actor network, which learns a policy, with a critic network, which estimates the expected value of a state or action."
What is deep reinforcement learning?,Deep reinforcement learning is a technique where deep neural networks are used in reinforcement learning tasks. It has been successful in tasks such as game playing and robot control.
What is inverse reinforcement learning?,Inverse reinforcement learning is a technique where a reinforcement learning agent learns the rewards function of a given task by observing the behavior of an expert. It can be used to transfer learned behaviors from an expert to a novice.
What is transfer learning in robotics?,"Transfer learning in robotics is a technique where a robot can transfer learned behaviors from one task to another. For example, a robot that learns to manipulate objects in a simulated environment may be able to transfer this knowledge to a real-world setting."
What is uncertainty estimation?,"Uncertainty estimation is the estimation of the uncertainty or confidence of a machine learning model. This is particularly important in safety-critical applications, such as robotics, where the consequences of incorrect decisions can be severe."
What is Monte Carlo dropout?,Monte Carlo dropout is a technique used to estimate the uncertainty of a neural network by averaging the predictions of the network with dropout applied multiple times.
What is Bayesian neural network?,A Bayesian neural network is a type of neural network that incorporates Bayesian principles into the training process. It can be used for uncertainty estimation and can improve the performance of the network in data-limited scenarios.
What is active learning?,Active learning is a type of machine learning where the algorithm actively selects the most informative data samples to be labeled by an expert. This can reduce the amount of labeled data required to train a high-performing model.
What is a kernel in a support vector machine?,"A kernel in a support vector machine is a function that transforms the input data to a higher-dimensional space, where the problem is easier to solve. Common kernels include linear, polynomial, and radial basis function kernels."
What is a support vector machine?,A support vector machine is a type of machine learning algorithm that is used for classification tasks. It works by finding the hyperplane that maximizes the margin between the classes in the input space.
What is a decision tree?,A decision tree is a type of machine learning algorithm that is used for classification and regression tasks. It works by recursively partitioning the input space into regions based on the values of the input features.
What is ensemble learning?,Ensemble learning is a technique where multiple machine learning models are combined to improve the performance of the overall model. This can be done by combining the outputs of the models or by training them together.
What is boosting?,Boosting is an ensemble learning technique where weak learners are combined to create a strong learner. It works by iteratively training weak learners on the misclassified examples of the previous learners.
What is bagging?,Bagging is an ensemble learning technique where multiple models are trained on subsets of the training data and their outputs are combined to form a final prediction.
What is a random forest?,A random forest is an ensemble learning technique that combines multiple decision trees. It works by training decision trees on random subsets of the input features and input
What is deep learning? ,Deep learning is a subset of machine learning that involves training artificial neural networks to perform tasks such as image or speech recognition.
What is an artificial neural network? ,"An artificial neural network is a mathematical model inspired by the way neurons in the human brain work. It consists of interconnected nodes or ""neurons"" that receive input and produce output."
How does deep learning differ from traditional machine learning? ,"Deep learning involves training complex neural networks with multiple hidden layers, whereas traditional machine learning approaches often use linear models and make assumptions about input features."
What types of problems can deep learning techniques solve? ,"Deep learning can be applied to image recognition, speech recognition, natural language processing, and many other tasks that involve complex patterns in data."
What is a convolutional neural network? ,A convolutional neural network is a type of neural network designed for image recognition tasks. It uses convolutional layers to extract features from input images and can learn to recognize objects and patterns.
What is a recurrent neural network? ,"A recurrent neural network is a type of neural network designed to handle sequences of input data, such as text or speech. It uses a form of feedback to remember past inputs and can learn to predict future outputs."
What is reinforcement learning? ,Reinforcement learning is a type of machine learning that involves training an agent to take actions in an environment to maximize a reward signal.
What is deep reinforcement learning? ,"Deep reinforcement learning involves using deep neural networks to represent the agent and the environment, allowing for more complex and sophisticated behaviors to emerge."
What is unsupervised learning? ,Unsupervised learning is a type of machine learning where the algorithm learns from data without explicit supervision or labeling.
What is supervised learning? ,Supervised learning is a type of machine learning where the algorithm learns to predict outputs based on labeled examples of inputs and outputs.
What is transfer learning? ,Transfer learning is a technique where a model trained on one task or domain is adapted to another related task or domain.
What is a loss function? ,A loss function is a mathematical function that measures the difference between predicted and actual outputs.
What is backpropagation? ,Backpropagation is a technique used to update the weights of a neural network by calculating the gradient of the loss function with respect to the network's parameters.
What is a hyperparameter? ,"A hyperparameter is a parameter that is set before training a model and controls the learning process, such as the number of hidden layers or the learning rate."
What is overfitting? ,Overfitting occurs when a model is too complex and performs well on the training data but poorly on new data.
What is underfitting? ,"Underfitting occurs when a model is too simple and cannot capture the complexity of the data, resulting in poor performance on both the training and test data."
What is a dropout layer? ,"A dropout layer is a technique used to prevent overfitting by randomly dropping out some nodes during training, forcing the network to learn more robust representations."
What is batch normalization? ,"Batch normalization is a technique used to normalize the input to each layer of a neural network, improving the stability of the training process."
What is transfer learning and how is it used in deep learning? ,"Transfer learning is a technique where a model trained on one task or domain is adapted to another related task or domain. In deep learning, pre-trained models can be fine-tuned on new tasks or datasets to improve performance and reduce the amount of data needed for training."
What is the difference between supervised and unsupervised learning? ,"Supervised learning involves learning from labeled data, whereas unsupervised learning involves learning from unlabeled data."
What is the difference between convolutional neural networks and recurrent neural networks? ,"Convolutional neural networks are designed for image recognition tasks and use convolutional layers to extract features from input images, whereas recurrent neural networks are designed for sequential data such as text or speech and use feedback to remember past inputs and predict future outputs."
What is the difference between deep learning and machine learning? ,"Deep learning is a subset of machine learning that involves training complex neural networks with multiple hidden layers, while machine learning encompasses a broader range of techniques for learning from data."
What is the difference between deep learning and artificial intelligence? ,"Deep learning is a subset of artificial intelligence that involves training artificial neural networks, while artificial intelligence encompasses a broader range of techniques for creating intelligent systems that can perform a variety of tasks."
What is a loss function and how is it used in training a deep learning model? ,A loss function is a mathematical function that measures the difference between predicted and actual outputs. It is used to guide the training process by minimizing or maximizing its value.
What is the role of activation functions in deep learning? ,Activation functions are used to introduce non-linearity into a neural network and allow it to model complex relationships between inputs and outputs.
What is the vanishing gradient problem in deep learning? ,"The vanishing gradient problem is a phenomenon where the gradients in a deep neural network become very small, making it difficult to train the network effectively."
What is deep belief learning? ,Deep belief learning is a type of unsupervised learning that involves training deep generative models to learn a probabilistic distribution over input data.
What is deep reinforcement learning and how is it used? ,"Deep reinforcement learning involves using deep neural networks to represent the agent and the environment, allowing for more complex and sophisticated behaviors to emerge. It is used in tasks such as game playing, robotics, and autonomous driving."
What is a convolutional layer? ,A convolutional layer is a type of layer in a neural network that passes a filter over the input data to extract local features.
What are pooling layers in deep learning? ,"Pooling layers are used to reduce the spatial dimensions of the input data, such as downsampling an image or summarizing a sequence of text."
What is the difference between a convolutional and a pooling layer in deep learning? ,"A convolutional layer extracts features from input data using a filter, whereas a pooling layer reduces the spatial dimensions of the input data."
What is a recurrent layer in deep learning? ,A recurrent layer is a type of layer in a neural network that uses feedback to remember past inputs and predict future outputs.
What is the difference between a recurrent and a convolutional layer in deep learning? ,"A recurrent layer is designed for sequential data such as text or speech and uses feedback to remember past inputs, whereas a convolutional layer is designed for image recognition tasks and extracts local features from input data."
What is backpropagation and how is it used in deep learning? ,Backpropagation is a technique used to update the weights of a neural network by calculating the gradient of the loss function with respect to the network's parameters. It is used to guide the training process and update the model's parameters.
What is the role of error backpropagation in training a deep neural network? ,"Error backpropagation is the process of calculating the gradient of the loss function with respect to the model's parameters, which is used to update the model's weights and improve its performance."
What is the role of activation functions in a deep neural network? ,Activation functions introduce non-linearity into a neural network and allow it to model more complex relationships between inputs and outputs.
What are the most common activation functions used in deep learning and when are they used? ,"The most common activation functions used in deep learning are ReLU (rectified linear unit) and its variants, which are used for their simplicity and effectiveness."
What is the difference between a generative model and a discriminative model in deep learning? ,"A generative model learns the distribution of input data, while a discriminative model learns the boundary between input and output data."
What is deep unsupervised learning and how is it used in deep learning? ,Deep unsupervised learning is a type of unsupervised learning that involves training deep generative models to learn the distribution of input data. It is used for tasks such as anomaly detection and data compression.
What is the difference between batch normalization and layer normalization in deep learning? ,"Batch normalization is a technique used to normalize the input to each layer of a neural network, improving the stability of the training process. Layer normalization is a similar technique that normalizes the input within each layer, allowing for more stable training in recurrent neural networks."
What is stochastic gradient descent and how is it used in deep learning? ,Stochastic gradient descent is a technique used to update the weights of a neural network by calculating the gradient of the loss function for a random subset of the training data. It is used to speed up the training process and prevent overfitting.
What is a kernel in deep learning? ,A kernel is a small matrix used to perform convolutional operations on input data in a neural network.
What is dropout and how is it used in deep learning? ,"Dropout is a technique used to prevent overfitting by randomly dropping out some nodes during training, forcing the network to learn more robust representations and reducing the number of parameters in the network."
What is a weight decay regularization and how is it used in deep learning? ,Weight decay regularization is a technique used to prevent overfitting by adding a penalty term to the loss function that encourages the weights of the network to stay small.
What is a deep belief network and how is it used in deep learning? ,"A deep belief network is a type of unsupervised learning model that consists of multiple layers of generative models. It is used for tasks such as anomaly detection, data compression, and feature learning."
What is an autoencoder and how is it used in deep learning? ,"An autoencoder is a type of deep neural network that is trained to reconstruct its input data. It is used for tasks such as data compression, feature extraction, and anomaly detection."
What is a variational autoencoder and how is it used in deep learning? ,"A variational autoencoder is a type of generative model that is trained to learn the distribution of input data. It is used for tasks such as data compression, feature extraction, and generative modeling."
What is a deep convolutional neural network and how is it used in deep learning? ,A deep convolutional neural network is a type of neural network designed for image recognition tasks. It uses convolutional layers to extract features from input images and can learn to recognize objects and patterns.
What is a long short-term memory (LSTM) network and how is it used in deep learning? ,"A long short-term memory (LSTM) network is a type of recurrent neural network that uses feedback to remember past inputs and predict future outputs. It is used for tasks such as speech recognition, natural language processing, and time-series forecasting."
What is a gated recurrent unit (GRU) and how is it used in deep learning? ,"A gated recurrent unit (GRU) is a type of recurrent neural network that uses feedback to remember past inputs and predict future outputs. It is used for tasks such as speech recognition, natural language processing, and time-series forecasting."
What is a deep Q-network (DQN) and how is it used in deep reinforcement learning? ,"A deep Q-network (DQN) is a type of deep reinforcement learning algorithm that uses a deep neural network to represent the Q-function, which maps states to actions. It is used for tasks such as game playing and robotics."
What is deep reinforcement learning and how is it used in robotic control? ,"Deep reinforcement learning involves using deep neural networks to represent the agent and the environment, allowing for more complex and sophisticated behaviors to emerge. It is used in robotic control tasks such as grasping, manipulation, and locomotion."
What is the difference between supervised and unsupervised learning in robotic control? ,"Supervised learning involves learning from labeled data, whereas unsupervised learning involves learning from unlabeled data. In robotic control tasks, supervised learning can be used for tasks such as grasping and manipulation, while unsupervised learning can be used for tasks such as exploration and data collection."
What is imitation learning and how is it used in robotic control? ,"Imitation learning involves learning to mimic the behavior of an expert by directly imitating their actions or by learning a reward function that incentivizes similar behavior. It is used in robotic control tasks such as manipulation, locomotion, and autonomous driving."
What is inverse reinforcement learning and how is it used in robotic control? ,Inverse reinforcement learning involves learning the reward function that motivates the behavior of an expert by observing their actions. It is used in robotic control tasks to learn reward functions for imitation learning and to model human behavior.
What is the difference between model-based and model-free reinforcement learning? ,"Model-based reinforcement learning involves learning a model of the environment and using this model to plan actions, while model-free reinforcement learning involves learning a policy or value function directly from experience."
