question,answer
What is machine learning? ,Machine learning is a subset of artificial intelligence that involves the development of algorithms and statistical models that enable machine systems to learn and improve automatically through experience.
What are the different types of machine learning?,"The different types of machine learning are supervised learning, unsupervised learning, reinforcement learning, and deep learning."
What are the advantages of machine learning? ,"Some advantages of machine learning are automation of tasks, improved accuracy, ability to learn from big data sets, and ability to adapt to changing patterns."
What is supervised learning?,Supervised learning is a type of machine learning algorithm in which the source of data has already been labelled and the algorithm learns to predict the output variable from the input.
What is unsupervised learning?,Unsupervised learning is a type of machine learning algorithm in which data is unlabelled and the algorithm learns to recognize patterns and classify the data on its own.
What is reinforcement learning?,Reinforcement learning is a type of machine learning algorithm in which an intelligent agent learns to take actions in an environment so as to maximize a numerical reward score.
What is deep learning?,"Deep learning is a subset of machine learning, wherein artificial neural networks, algorithms, or models automatically learn to perform tasks such as image and speech recognition."
What is transfer learning?,Transfer learning is a type of machine learning in which knowledge or techniques learnt in one domain is used to solve a different problem domain.
What is active learning?,Active learning is a type of machine learning in which the algorithm interacts with the user or domain expert to identify the right set of features for prediction or model building.
What is feature engineering?,Feature engineering is a process of selecting relevant features that are useful for prediction or model building in machine learning.
What is overfitting?,"Overfitting occurs when the machine learning algorithm fits the training data too closely, and as a result, it becomes less accurate when predicting new data."
What is underfitting?,"Underfitting occurs when the machine learning algorithm is too simple and does not capture important patterns in the training data, leading to poor predictions on new data."
What is cross-validation?,Cross-validation is a technique used to assess the accuracy of a model based on predicting new data by partitioning the sample data into various groups.
What is a neural network?,"A neural network is an algorithm that is designed to recognize patterns in data, inspired by the workings of the human brain."
What is a decision tree?,A decision tree is a decision-making tool that uses a tree-like model of decisions and their possible consequences to explore all possible outcomes.
What is a random forest?,"A random forest is an ensemble learning method used for classification, regression and other tasks which operate by constructing a multitude of decision trees."
What is a support vector machine?,"Support vector machine is a type of algorithm that is used for linear and nonlinear classification, regression, and outlier detection."
What is natural language processing?,"Natural language processing is a branch of machine learning that enables computers to interpret, understand and generate human language."
What is supervised learning used for?,"Supervised learning is used for tasks such as classification and regression, where the machine learning algorithm learns to predict the output from the input based on labelled information."
What is unsupervised learning used for?,"Unsupervised learning is used for tasks such as clustering and anomaly detection, where the algorithm learns to recognize patterns and classify the data on its own."
What is deep learning used for?,"Deep learning is used for tasks such as image and speech recognition, natural language processing, and computer vision, where the machine learns to interpret and analyze large amounts of data."
What is reinforcement learning used for?,"Reinforcement learning is used for tasks such as robotics, game playing, and navigation, where the machine learns to take actions in an environment to maximize a reward."
What is transfer learning used for?,Transfer learning is used to leverage existing knowledge and transfer it to a new domain for solving a new problem effectively.
What is an artificial neural network used for?,"Artificial neural networks are used for tasks such as image and speech recognition, natural language processing, and computer vision, where the machine learns to interpret and analyze large amounts of data."
What is logistic regression used for?,Logistic regression is a type of supervised learning algorithm used to predict the probability of a binary (yes or no) outcome. 
What is k-means clustering used for?,K-means clustering is a type of unsupervised learning algorithm used to divide data into multiple groups or clusters based on similarity
What is dimensionality reduction used for? ,"Dimensionality reduction is used to reduce the number of features in a data set, while preserving the important patterns in the data."
What is an artificial neural network?,"Artificial neural networks are a type of algorithm designed to recognize patterns in data, inspired by the workings of the human brain."
What is the perceptron algorithm?,The perceptron algorithm is a linear classification algorithm used in machine learning for binary classification problems.
How do you handle missing values in machine learning?,"Missing values can be handled in machine learning by imputation, a technique that replaces the missing values with estimated values, or by deletion of observations with missing values."
What is supervised learning?,Supervised learning is a type of machine learning where the model learns by training on a set of labelled examples to find patterns in the data to help make predictions for new examples.
What is unsupervised learning?,"Unsupervised learning is a type of machine learning where the model learns without being given any labelled examples, instead it explores the data structure to find patterns."
What is reinforcement learning?,Reinforcement learning is a type of machine learning where an agent learns how to behave in an environment by performing actions and receiving rewards or punishments.
What are the steps involved in building a machine learning model?,"Building a machine learning model involves defining the problem, collecting and processing data, selecting an appropriate algorithm, training the model, and evaluating its performance."
What is a decision tree?,A decision tree is a graphical representation of a set of rules used to classify data based on the attributes of the data.
What is a random forest?,A random forest is a machine learning model that uses a collection of decision trees to classify data.
What is a support vector machine?,A support vector machine is a machine learning model that separates data by finding the best hyperplane between different classes.
What is a neural network?,A neural network is a machine learning model that is inspired by the structure of the human brain and is used to recognize patterns in data.
What are the different types of learning algorithms used in machine learning?,"There are three types of learning algorithms used in machine learning, which are supervised learning, unsupervised learning, and reinforced learning."
What is deep learning?,Deep learning is a subset of machine learning that uses artificial neural networks to learn from large sets of data to make predictions or decisions.
What is transfer learning?,Transfer learning is a technique used to improve the performance of a machine learning model by transferring its learned knowledge to a similar but different problem.
What is the difference between machine learning and deep learning? ,Machine learning is a type of artificial intelligence that involves the development of algorithms and statistical models to enable machine systems to learn and improve on their own. Deep learning is a subset of machine learning that utilizes artificial neural networks to learn from large sets of data.
What is the difference between supervised and unsupervised learning?,"Supervised learning is used when the data is labelled, and the machine learning algorithm learns through training and iterations to predict the required output. Unsupervised learning is used when the data is unlabelled, and the machine learning algorithm learns the structure of the data to predict the output."
What is the difference between classification and regression in machine learning?,"Classification is used to predict categorical responses, whereas regression is used to predict continuous responses."
What are the limitations of machine learning?,"Some common limitations of machine learning are that it requires significant computing power, data quality affects its performance, and the models may require significant recalibration."
What are neural networks used for? ,"Neural networks are used for tasks such as image and speech recognition, natural language processing, and computer vision, where they learn to interpret and analyze large amounts of data."
What is feature selection in machine learning?,Feature selection is the process of selecting relevant features that are useful for prediction or model building in machine learning.
What is a neural network algorithm?,"A neural network algorithm is an algorithm designed to recognize patterns in data, inspired by the workings of the human brain."
What is a dummy variable in machine learning?,A dummy variable is used to transform categorical data into a numerical format for processing in machine learning algorithms.
What is the SVM algorithm in machine learning?,"Support vector machine (SVM) is a machine learning algorithm used for classification, regression, and outlier detection in the data."
What is the difference between data mining and machine learning?,"Data mining is the process of discovering patterns in large data sets, whereas machine learning involves the development of algorithms and statistical models to enable machine systems to learn and improve automatically through experience."
What is the difference between deep learning and machine learning?,Deep learning is a subset of machine learning that utilizes artificial neural networks to learn from large sets of data.
How do you know which algorithm to use in machine learning?,"The choice of algorithm in machine learning depends on the type of problem, the nature of the data, and the desired outcome."
What is the difference between a test set and a validation set in machine learning?,"A validation set is used during model development to select the best model by adjusting hyperparameters, whereas a test set is used to evaluate the final performance of the model."
What is the difference between a linear and a logistic regression in machine learning?,"Linear regression is used to predict a continuous output, whereas logistic regression is used to predict a binary output."
What is the difference between deep learning and artificial intelligence?,"Deep learning is a subset of machine learning that utilizes artificial neural networks to learn from large sets of data, whereas artificial intelligence includes a wider range of techniques not limited to machine learning."
What is the Bayesian learning algorithm?,Bayes' theorem is used in Bayesian learning algorithms to calculate the probability of a hypothesis based on prior knowledge and evidence to make predictions about future events.
What is hyperparameter tuning in machine learning?,Hyperparameter tuning is the process of selecting the best hyperparameters for a machine learning algorithm to maximize performance.
What is a decision boundary in machine learning?,A decision boundary is the border that separates different classes or clusters in a machine learning model.
What is the difference between a decision tree and a random forest in machine learning?,"A decision tree is a graph or model of decisions and their consequences whereas, a random forest is an ensemble learning method used for classification, regression and other tasks which operate by constructing a multitude of decision trees."
What is the difference between supervised and unsupervised machine learning?,"Supervised learning involves the use of labelled data to make predictions, while unsupervised learning involves the discovery of patterns in unlabelled data."
What are some common applications of machine learning?,"Some common applications of machine learning include facial recognition, predictive maintenance, chatbots, fraud detection, recommendation systems, and speech recognition."
What is the difference between classification and regression in machine learning?,"Classification is used to predict categorical responses, whereas regression is used to predict continuous responses."
What is a neural network in machine learning?,"A neural network is an algorithm designed to recognize patterns in data, inspired by the workings of the human brain."
What is deep learning in machine learning?,Deep learning is a subset of machine learning that utilizes artificial neural networks to learn from large sets of data.
How do you measure the performance of a machine learning model?,"Machine learning model performance can be measured using metrics such as accuracy, precision, recall, F1 score, and ROC AUC."
What is the difference between natural language processing and machine learning?,Natural language processing is a branch of machine learning that involves the development of algorithms and statistical models to enable machines to interpret and generate human languages.
What is a confusion matrix in machine learning?,A confusion matrix is a table used to evaluate the performance of a machine learning model by comparing actual values with predicted values.
What is the difference between batch and online learning?,"Batch learning involves processing all training data at once, whereas online learning involves processing the data incrementally as it comes in."
What is a recommendation system in machine learning?,A recommendation system is a type of machine learning model that provides personalized recommendations to users based on their past behaviour or preferences.
What is a kernel in machine learning?,A kernel is a function used to transform data into a higher-dimensional space for better separability.
What is a regularization parameter in machine learning?,"A regularization parameter is a value used to control the complexity of a machine learning model, reducing the risk of overfitting."
What is an ensemble in machine learning?,An ensemble is a combination of multiple machine learning models that are combined to improve the overall performance of the system.
What is transfer learning in machine learning?,Transfer learning involves using pre-trained machine learning models to boost the performance of new models.
What is the curse of dimensionality in machine learning?,The curse of dimensionality refers to the difficulty in building accurate models due to the exponential increase in data size as the number of dimensions increases.
What are some of the limitations of machine learning?,"Some limitations of machine learning include the need for large amounts of high-quality data, potential for bias, interpretability of the model, and lack of framework."
What is meant by overfitting in machine learning? ,"Overfitting is the process whereby a machine learning model becomes more complex than necessary for a given problem, leading to poor performance when used to make predictions on new data."
What is meant by regularization in machine learning? ,Regularization involves employing techniques to limit the complexity of a statistical model and prevent overfitting.
What are some common preprocessing techniques in machine learning?,"Common preprocessing techniques in machine learning include normalization, scaling, and data cleaning."
What is meant by cross-validation in machine learning?,"Cross-validation is a technique whereby a machine learning model is trained on multiple subsets of the data and tested on a different subset, to prevent overfitting."
How do you evaluate the performance of a machine learning model?,"Machine learning model performance can be evaluated using metrics such as accuracy, precision, recall, F1 score, and ROC AUC."
What is a decision tree in machine learning?,A decision tree is a graphical representation of a set of rules used to classify data based on the attributes of the data.
What is a confusion matrix in machine learning?,A confusion matrix is a table used to evaluate the performance of a machine learning model by comparing actual values with predicted values.
What is meant by feature engineering in machine learning?,Feature engineering involves selecting the most relevant features in a dataset to build a model that performs well on new data.
What is a neural network in machine learning?,"A neural network is an algorithm designed to recognize patterns in data, inspired by the workings of the human brain."
What is a kernel in machine learning?,A kernel is a function used to transform data into a higher-dimensional space for better separability.
What is a regularization parameter in machine learning?,"A regularization parameter is a value used to control the complexity of a machine learning model, reducing the risk of overfitting."
What is an ensemble in machine learning?,An ensemble is a combination of multiple machine learning models that are combined to improve the overall performance of the system.
What is transfer learning in machine learning?,Transfer learning involves using pre-trained machine learning models to boost the performance of new models.
What are the advantages and disadvantages of using machine learning?,"Advantages of machine learning include increased efficiency, reduced errors, and increased accuracy. Disadvantages may include bias and the need for large amounts of high-quality data."
What is the difference between supervised and unsupervised learning in machine learning?,"Supervised learning involves the use of labelled data to make predictions, while unsupervised learning involves the discovery of patterns in unlabelled data."
What is the difference between a model and an algorithm in machine learning?,"A model is a function that maps input to output based on parameters learned from training data, while an algorithm is a set of instructions followed by a computer program to complete a task."
What is the difference between batch and online learning in machine learning?,"Batch learning involves processing all training data at once, whereas online learning involves processing the data incrementally as it comes in."
What is the difference between a decision tree and a random forest in machine learning?,"A decision tree is a graphical representation of a set of rules used to classify data, while a random forest is an ensemble learning method that combines multiple decision trees."
What is the difference between a support vector machine and a neural network in machine learning?,"A support vector machine separates data by finding the best hyperplane between different classes, while a neural network is an algorithm designed to recognize patterns in data, inspired by the workings of the human brain."
What is the role of data preprocessing in machine learning?,"Data preprocessing involves cleaning data, transforming variables, and reducing the dimensionality of data to improve the performance of machine learning models."
How do you choose the appropriate machine learning algorithm for a given problem?,"The appropriate machine learning algorithm is chosen based on the type of problem, the nature of the data, and the desired outcome."
What is the role of feature selection in machine learning?,Feature selection involves selecting the most relevant features in a dataset to build a model that performs well on new data.
What is transfer learning in machine learning?,Transfer learning involves using pre-trained machine learning models to boost the performance of new models.
What is the difference between a test set and a validation set in machine learning?,"A validation set is used during model development to select the best model by adjusting hyperparameters, whereas a test set is used to evaluate the final performance of the model."
What is the difference between supervised and unsupervised learning?,"Supervised learning is used when the data is labelled and the machine learning algorithm learns through training and iterations to predict the required output. Unsupervised learning is used when the data is unlabelled, and the machine learning algorithm learns the structure of the data to predict the output."
What is natural language processing (NLP)? ,NLP is a branch of artificial intelligence that deals with the interaction between computers and human language.
How does natural language processing work? ,NLP systems use machine learning and statistical techniques to analyze and understand human language.
What are some applications of natural language processing? ,"NLP is used in automated text translation, sentiment analysis, chatbots, speech recognition, and text classification."
What are the advantages of using natural language processing? ,"NLP enables computers to process and understand human language, which can save time and increase efficiency in many areas."
What are the challenges of natural language processing? ,"The challenges include understanding context and ambiguity, dealing with different languages and nuances, and adapting to changes in language use over time."
What is the difference between natural language processing and natural language generation? ,"NLP deals with understanding human language, while natural language generation involves creating human-like language."
What is speech recognition and how does it use natural language processing? ,Speech recognition is the process of converting spoken words into digital text. NLP is used to analyze the language and determine what was said.
What is sentiment analysis and how does it use natural language processing? ,"Sentiment analysis is the process of determining the emotional tone of a piece of text. NLP is used to analyze the language and identify positive, negative, or neutral sentiment."
What is named entity recognition and how does it use natural language processing? ,"Named entity recognition is the process of identifying and classifying entities in text, such as people, places, and organizations. NLP is used to analyze the language and identify these entities."
What is text classification and how does it use natural language processing? ,Text classification is the process of categorizing text into different classes or categories. NLP is used to analyze the language and identify the relevant features that can be used for classification.
What is the difference between rule-based and machine learning-based natural language processing? ,"Rule-based NLP involves defining rules and patterns to analyze language, while machine learning-based NLP involves training algorithms to learn from data and make predictions."
What are some popular open-source natural language processing tools? ,"NLTK, SpaCy, and Stanford NLP are some popular open-source NLP tools."
What is corpus linguistics and how does it relate to natural language processing? ,"Corpus linguistics is the study of text corpora, which are collections of texts used for linguistic research. NLP relies on text corpora for training and testing machine learning algorithms."
What is the difference between unsupervised and supervised learning in natural language processing? ,"Unsupervised learning involves discovering patterns and structures in data without training data, while supervised learning uses labeled data to train algorithms."
What is word sense disambiguation and how does it use natural language processing? ,Word sense disambiguation is the process of identifying the correct meaning of a word in context. NLP is used to analyze the language and determine the appropriate sense of a word.
What is part-of-speech tagging and how does it use natural language processing? ,Part-of-speech tagging is the process of labeling each word in a sentence with its part of speech. NLP is used to analyze the language and identify the appropriate part of speech for each word.
What is parsing and how does it use natural language processing? ,Parsing is the process of analyzing the syntactic structure of a sentence. NLP is used to analyze the language and identify the rules that govern the structure of a sentence.
What is semantic analysis and how does it use natural language processing? ,Semantic analysis is the process of extracting meaning from text. NLP is used to analyze the language and identify the relationships between words and phrases.
What is topic modeling and how does it use natural language processing? ,Topic modeling is the process of identifying topics in a collection of documents. NLP is used to analyze the language and identify the relevant features that can be used for topic modeling.
What is machine translation and how does it use natural language processing? ,Machine translation is the process of translating text from one language to another using computers. NLP is used to analyze the language and generate the appropriate translation.
What is an artificial neural network and how does it relate to natural language processing? ,An artificial neural network is a type of machine learning algorithm that is inspired by the structure of the human brain. It can be used for various NLP tasks such as sentiment analysis and machine translation.
