question,answer
What is actor-critic reinforcement learning and how is it used in robotic control? ,"Actor-critic reinforcement learning involves using two networks, one for learning a policy or actor and one for learning a value function or critic. It is used in robotic control tasks such as manipulation and autonomous driving."
What is deep learning transfer learning and how is it used in robotics? ,Deep learning transfer learning involves adapting a pre-trained neural network to a new task or domain. It is used in robotic control tasks to improve performance and reduce the amount of data needed for training.
What are the limitations of deep learning in robotic control? ,"The limitations of deep learning in robotic control include issues such as sample efficiency, safety, and interpretability."
What is adversarial training and how is it used in deep learning? ,Adversarial training involves training a model to be robust to adversarial perturbations by adding adversarial examples to the training data. It is used to improve the security and robustness of deep learning models.
What is deep reinforcement learning and how is it used in game playing? ,"Deep reinforcement learning involves using deep neural networks to represent the agent and the environment, allowing for more complex and sophisticated behaviors to emerge. It is used in game playing tasks such as Atari games and chess."
What is the difference between supervised and unsupervised learning in game playing? ,"Supervised learning involves learning from labeled data, whereas unsupervised learning involves learning from unlabeled data. In game playing tasks, supervised learning can be used to learn from expert demonstrations, while unsupervised learning can be used for tasks such as exploration and data collection."
What is policy gradient reinforcement learning and how is it used in game playing? ,Policy gradient reinforcement learning involves directly optimizing the policy of an agent to maximize the expected reward. It is used in game playing tasks such as Atari games and chess.
What is Q-learning and how is it used in game playing? ,Q-learning is a type of model-free reinforcement learning algorithm that is used to learn a value function or Q-function. It is used in game playing tasks such as Atari games and chess.
What is the difference between model-based and model-free reinforcement learning in game playing? ,"Model-based reinforcement learning involves learning a model of the environment and using this model to plan actions, while model-free reinforcement learning involves learning a policy or value function directly from experience."
What is deep learning transfer learning and how is it used in game playing? ,Deep learning transfer learning involves adapting a pre-trained neural network to a new task or domain. It is used in game playing tasks to improve performance and reduce the amount of data needed for training.
What is adversarial training and how is it used in game playing? ,Adversarial training involves training a model to be robust to adversarial perturbations by adding adversarial examples to the training data. It is used to improve the security and robustness of deep learning models in game playing tasks.
What is a generative adversarial network (GAN) and how is it used in deep learning? ,A generative adversarial network (GAN) is a type of deep neural network that learns to generate realistic samples from a given distribution. It is used for tasks such as image synthesis and data augmentation.
What is a variational autoencoder (VAE) and how is it used in deep learning? ,"A variational autoencoder (VAE) is a type of generative model that is trained to learn the distribution of input data. It is used for tasks such as data compression, feature extraction, and generative modeling."
What is reinforcement learning and how is it used in robotics? ,"Reinforcement learning is a type of machine learning that involves training an agent to take actions in an environment to maximize a reward signal. It is used in robotics tasks such as grasping, manipulation, and autonomous driving."
What is imitation learning and how is it used in robotics? ,"Imitation learning involves learning to mimic the behavior of an expert by directly imitating their actions or by learning a reward function that incentivizes similar behavior. It is used in robotics tasks such as manipulation, locomotion, and autonomous driving."
What is the difference between supervised and unsupervised learning in robotics? ,"Supervised learning involves learning from labeled data, while unsupervised learning involves learning from unlabeled data. In robotics, supervised learning can be used for tasks such as object recognition and grasping, while unsupervised learning can be used for tasks such as exploration and data collection."
What is inverse reinforcement learning and how is it used in robotics? ,Inverse reinforcement learning involves learning the reward function that motivates the behavior of an expert by observing their actions. It is used in robotics to model human behavior and to learn reward functions for imitation learning.
What is the difference between model-based and model-free reinforcement learning in robotics? ,"Model-based reinforcement learning involves learning a model of the environment and using this model to plan actions, while model-free reinforcement learning involves learning a policy or value function directly from experience. In robotics, model-based reinforcement learning can be used for tasks such as planning and navigation, while model-free reinforcement learning can be used for tasks such as grasping and manipulation."
What is deep learning transfer learning and how is it used in robotics? ,Deep learning transfer learning involves adapting a pre-trained neural network to a new task or domain. It is used in robotics to improve performance and reduce the amount of data needed for training.
What is Bayesian deep learning and how is it used in deep learning? ,"Bayesian deep learning is an approach to deep learning that involves modeling uncertainty using Bayesian methods. It is used for tasks such as data compression, image synthesis, and anomaly detection."
What is the difference between deep learning and traditional statistics? ,"Deep learning uses neural networks to learn complex relationships between inputs and outputs, while traditional statistics uses models to make assumptions about the underlying probability distributions."
What is the difference between deep learning and fuzzy logic? ,"Deep learning is a type of machine learning that uses neural networks to model complex relationships between inputs and outputs, while fuzzy logic is a mathematical framework for dealing with uncertainty and incomplete information."
What is the difference between deep learning and artificial neural networks? ,"Deep learning is a subset of machine learning that involves training complex neural networks with multiple hidden layers, while artificial neural networks refer to the broader class of mathematical models inspired by the way neurons in the brain work."
What is a data structure?,A data structure refers to a way in which data is organized or arranged in a computer system.
What are some examples of data structures?,"Arrays, linked lists, queues, stacks, binary trees, hash tables, graphs, etc."
How are data structures used in computer science?,Data structures are used to store and organize large amounts of data efficiently and effectively.
What is the difference between an array and a linked list?,"An array is a collection of elements of the same data type, while a linked list is a collection of nodes that contain both data and a reference to the next node."
When should an array be used over a linked list?,Arrays are typically used when a fixed number of elements are needed and when random access to elements is required.
When should a linked list be used over an array?,Linked lists are typically used when elements need to be inserted or removed frequently and when memory allocation is dynamic.
What is a tree data structure?,A tree data structure is a way to organize data in a hierarchical structure resembling a tree.
What is a binary tree?,A binary tree is a tree data structure in which each node has at most two children.
What are the benefits of using a binary tree?,"Binary trees allow for efficient searching, inserting, and deleting of elements."
What is a balanced tree?,A balanced tree is a tree data structure in which the heights of the subtrees of any node differ by at most 1.
What is a hash table?,"A hash table is a data structure that allows for efficient insertion, deletion, and searching of data by using a hash function to map each key to a specific index in an array."
What is a queue data structure?,A queue is a collection of elements that allows for adding elements to the back and removing elements from the front.
What is a stack data structure?,A stack is a collection of elements that allows for adding and removing elements from the top.
What are the benefits of using a stack data structure?,"Stacks are useful in programming languages for handling function calls and recursion, as well as for implementing undo and redo features in applications."
What is a priority queue data structure?,"A priority queue is a type of queue in which each element has a priority associated with it, allowing for the highest-priority elements to be processed first."
What is a graph data structure?,A graph is a collection of vertices (nodes) and edges (connections between vertices) that can be used to model relationships between data.
What is a breadth-first search?,A breadth-first search is a graph traversal algorithm that explores all nodes at the current depth before moving on to the next depth.
What is a depth-first search?,A depth-first search is a graph traversal algorithm that explores as far as possible along each branch before backtracking.
What is the difference between a graph and a tree?,"A tree is a type of graph in which there is only one path between any two nodes, while a graph can have multiple paths between nodes."
What is a trie data structure?,"A trie, also known as a prefix tree, is a tree-like data structure used to store strings, where each node represents a letter in the string."
What is a segment tree?,A segment tree is a tree-like data structure used to handle range query problems.
What is a B-tree?,A B-tree is a self-balancing tree data structure used to store and retrieve large amounts of data in secondary storage systems.
What is a red-black tree?,A red-black tree is a self-balancing binary search tree data structure used to implement associative arrays and sets.
What is a skip list?,"A skip list is a probabilistic data structure used to allow efficient search, insertion, and deletion operations in a sorted list."
What is the difference between a hash table and a binary search tree?,"A hash table typically has constant time complexity for insertion, deletion, and searching, while a binary search tree has logarithmic time complexity for the same operations."
What is a self-balancing tree?,A self-balancing tree is a type of tree data structure that automatically maintains a balance between the height of the tree and the number of nodes it contains.
What is an AVL tree?,"An AVL tree is a self-balancing binary search tree data structure that is named after its inventors, Adelson-Velskii and Landis."
What is a splay tree?,A splay tree is a self-adjusting binary search tree data structure that brings recently accessed elements closer to the root to improve search times.
What is a Fibonacci heap?,A Fibonacci heap is a type of heap data structure used to implement priority queues that has faster performance for some operations than binary heaps.
What is a disjoint-set data structure?,A disjoint-set data structure is a way to track a partitioning of a set into disjoint subsets that supports operations such as checking if two elements belong to the same subset and merging two subsets together.
What is a binary heap?,"A binary heap is a complete binary tree data structure in which every parent node has either one or two child nodes, and the key of each parent node is either greater than or equal to (in a max heap) or less than or equal to (in a min heap) the keys of its children."
What is a Fibonacci search?,"A Fibonacci search is a search algorithm that uses the Fibonacci sequence to determine the search interval, resulting in a more optimal search time than binary search for certain types of data."
What is a suffix tree?,A suffix tree is a tree-based data structure used to store and search for occurrences of all suffixes of a given string.
What is a suffix array?,A suffix array is an array-based data structure used to store and search for occurrences of all suffixes of a given string.
What is dynamic programming?,Dynamic programming is a technique used to solve problems by breaking them down into smaller subproblems and using the results of those subproblems to solve the original problem.
How is dynamic programming used in data structures?,"Dynamic programming can be used to design efficient algorithms for working with certain data structures, such as trees and graphs."
What is memoization?,Memoization is a technique used in dynamic programming to store the results of expensive function calls and return the cached result when the same inputs occur again.
How is memoization used in data structures?,"Memoization can be used in algorithms that involve searching, sorting, or traversing data structures to improve performance and optimize memory usage."
What is an algorithm?,An algorithm is a step-by-step procedure for solving a problem or performing a task.
Why are algorithms important in data structures?,Algorithms are important in data structures because they provide a way to efficiently and effectively work with larger and more complex data sets.
What is the time complexity of an algorithm?,The time complexity of an algorithm is a measure of how much time it takes to run as a function of the input size.
What is the space complexity of an algorithm?,The space complexity of an algorithm is a measure of how much memory it requires to run as a function of the input size.
What is Big O notation?,Big O notation is a mathematical notation used to describe the asymptotic behavior of an algorithm in terms of its time complexity or space complexity.
What is the worst-case scenario for an algorithm?,The worst-case scenario for an algorithm is the scenario in which it takes the longest amount of time or uses the most memory to complete.
What is the average-case scenario for an algorithm?,The average-case scenario for an algorithm is the scenario in which it takes an average amount of time or uses an average amount of memory to complete.
What is the best-case scenario for an algorithm?,The best-case scenario for an algorithm is the scenario in which it takes the shortest amount of time or uses the least memory to complete.
What is the difference between a data structure and an algorithm?,"A data structure is a way in which data is organized or arranged, while an algorithm is a procedure for solving a problem or performing a task using that data structure."
What is the efficiency of an algorithm?,The efficiency of an algorithm refers to how much time and memory it requires to run.
What is the difference between a linked list and an array?,"A linked list uses nodes to store data, while an array stores data in continuously allocated memory."
What is the difference between a stack and a queue?,"A stack is a last in, first out (LIFO) data structure, while a queue is a first in, first out (FIFO) data structure."
What is the difference between hashing and searching?,"Hashing is a way to retrieve data based on its unique key value using a hash table, while searching is a way to find data based on a given value or set of values."
What is the difference between breadth-first search and depth-first search?,"Breadth-first search explores all nodes at the current depth before moving on to the next depth, while depth-first search explores one branch of the tree as far as possible before backtracking."
What is the difference between a binary search and linear search?,Binary search is a search algorithm that divides the search region in half at each step while linear search checks each element in sequence until the desired element is found.
What is the difference between a heap and a binary search tree?,"A heap is an unordered tree data structure, where each parent node is less than or equal to (in a min heap) or greater than or equal to (in a max heap) its child nodes, while a binary search tree is a binary tree where the left child of a node has a smaller value and the right child of a node has a larger value."
What is the difference between a binary search tree and an AVL tree?,"An AVL tree is a type of self-balancing binary search tree that guarantees a balance factor of -1, 0, or 1 for every node, while a binary search tree may become unbalanced over time."
What is the difference between a red-black tree and an AVL tree?,"A red-black tree is a type of self-balancing binary search tree that balances itself by recoloring and rotating nodes, while an AVL tree balances itself by rotating subtrees."
What is the difference between a splay tree and an AVL tree?,"A splay tree is a self-adjusting binary search tree that brings recently accessed elements closer to the root to improve search times, while an AVL tree focuses on maintaining a balance factor of -1, 0, or 1 at every node."
What is the difference between a hash table and a dictionary?,"A hash table is a data structure that maps keys to values using a hash function, while a dictionary is a collection of key-value pairs."
What is the difference between a queue and a priority queue?,"A queue is a collection of elements that allows for adding elements to the back and removing elements from the front, while a priority queue is a queue that orders elements based on their priority."
What is the difference between a stack and a priority queue?,"A stack is a collection of elements that allows for adding and removing elements from the top, while a priority queue is a queue that orders elements based on their priority."
What is the difference between a graph and a tree?,"A tree is a type of graph in which there is only one path between any two nodes, while a graph can have multiple paths between nodes."
What is the difference between a weighted and an unweighted graph?,"A weighted graph has a value associated with each edge, while an unweighted graph does not."
What is the difference between a directed and an undirected graph?,"A directed graph has directed edges, while an undirected graph has undirected edges."
What is the difference between a tree and a trie?,"A tree is a data structure used to organize data in a hierarchical structure resembling a tree, while a trie is a tree-like data structure used to store strings."
What is the difference between a stack and a heap?,"A stack is a data structure used to store and manage function calls and local variables, while a heap is a region of memory used for dynamic memory allocation."
What is the difference between a splay tree and a binary tree?,"A splay tree is a self-adjusting binary search tree that brings recently accessed elements closer to the root to improve search times, while a binary tree is a tree data structure in which each node has at most two children."
What is the difference between a binary heap and a Fibonacci heap?,"A binary heap is a complete binary tree with the heap property, while a Fibonacci heap is a heap data structure that has faster performance for some operations than binary heaps."
What is the difference between a hash table and an open addressing hash table?,"A hash table uses a hash function to map each key to a value in the table, while an open addressing hash table uses a probing sequence to search for an empty slot in the table when a collision occurs."
What is the difference between a hash table and a chaining hash table?,"A hash table uses a hash function to map each key to a value in the table, while a chaining hash table uses linked lists to store multiple values at each slot in the table when collisions occur."
What is the difference between a binary tree and a binary search tree?,"A binary tree is a tree data structure in which each node has at most two children, while a binary search tree is a binary tree where the left child of a node has a smaller value and the right child of a node has a larger value."
What is the difference between a binary tree and a balanced binary tree?,"A balanced binary tree is a version of a binary tree where the heights of the subtrees of any node differ by at most 1, while a binary tree may become unbalanced over time."
What is the difference between a balanced binary tree and an unbalanced binary tree?,"A balanced binary tree is a version of a binary tree where the heights of the subtrees of any node differ by at most 1, while an unbalanced binary tree may have subtrees that differ in height by more than 1."
What is the difference between a breadth-first search and a Dijkstra's algorithm?,"A breadth-first search is a graph traversal algorithm that explores all nodes at the current depth before moving on to the next depth, while Dijkstra's algorithm is a shortest-path algorithm that finds the shortest path between two nodes in a weighted graph."
What is the difference between a stack and a linked list?,"A stack is a last in, first out (LIFO) data structure, while a linked list is a collection of nodes that contain both data and a reference to the next node."
What is the difference between an array and a heap?,"An array is a collection of elements of the same data type, while a heap is a region of memory used for dynamic memory allocation."
What is the difference between a priority queue and a heap?,"A priority queue is a queue that orders elements based on their priority, while a heap is a complete binary tree with the heap property."
What is the difference between a linked list and a doubly linked list?,"A linked list uses nodes to store data, while a doubly linked list uses nodes that contain both data and references to both the next and previous nodes."
What is the difference between a hash table and a B-tree?,"A hash table uses a hash function to map each key to a value in the table, while a B-tree is a self-balancing tree data structure used to store and retrieve large amounts of data in secondary storage systems."
What is the difference between a breadth-first search and a depth-first search on a tree?,"A breadth-first search on a tree explores all nodes at the current depth before moving on to the next depth, while a depth-first search on a tree explores one branch of the tree as far as possible before backtracking."
What is the difference between a binary heap and a binary search tree?,"A binary heap is a complete binary tree with the heap property, while a binary search tree is a binary tree where the left child of a node has a smaller value and the right child of a node has a larger value."
What is the difference between a hash table and a skip list?,"A hash table uses a hash function to map each key to a value in the table, while a skip list is a probabilistic data structure used to allow efficient search, insertion, and deletion operations in a sorted list."
What is the difference between an AVL tree and a red-black tree?,"An AVL tree is a type of self-balancing binary search tree that is named after its inventors, Adelson-Velskii and Landis, while a red-black tree is a self-balancing binary search tree that balances itself by recoloring and rotating nodes."
What is the difference between hashing and encryption?,"Hashing is a one-way function used to create a fixed-length value from variable-length data, while encryption is a process of converting plaintext into a coded message that can be decoded by the recipient."
What is the difference between a B-tree and a B+ tree?,"A B-tree is a self-balancing tree data structure used to store and retrieve large amounts of data in secondary storage systems, while a B+ tree is a variant of a B-tree where all data is stored in leaf nodes."
What is the difference between a hash table and a radix tree?,"A hash table uses a hash function to map each key to a value in the table, while a radix tree is a tree-like data structure used to store and search for strings."
What is the difference between a stack and a queue on a deque?,"A stack on a deque is a stack that allows for adding and removing elements from both ends of a doubly-ended queue, while a queue on a deque is a queue that allows for adding and removing elements from both ends of a doubly-ended queue."
What is the difference between a linked list and a circular linked list?,"A linked list uses nodes to store data, while a circular linked list is a linked list where the last node points back to the first node, creating a circular structure."
What is the difference between a singly linked list and a doubly linked list?,"A singly linked list uses nodes that contain both data and a reference to the next node, while a doubly linked list uses nodes that contain both data and references to both the next and previous nodes."
What is the difference between a linear search and a binary search?,"Linear search is a search algorithm that checks each element in sequence until the desired element is found, while binary search is a search algorithm that divides the search region in"
What is an algorithm?,An algorithm is a set of instructions designed to solve a specific problem or accomplish a specific task.
