question,answer
What are some common examples of algorithms?,"Sorting algorithms, searching algorithms, encryption algorithms, compression algorithms, and machine learning algorithms are some common examples of algorithms."
What is the difference between an algorithm and a program?,"An algorithm is a set of instructions in a logical order, while a program is the translation of those instructions into a specific programming language."
What are some characteristics of a good algorithm?,"A good algorithm is efficient, correct, and easy to understand and modify."
What is the purpose of analyzing algorithms?,"Analyzing algorithms helps us understand their time and space complexity, which can help us choose the best algorithm for a given problem."
What is time complexity?,"Time complexity is a measure of how long an algorithm takes to solve a problem, usually measured in terms of the number of operations required."
What is space complexity?,"Space complexity is a measure of how much memory an algorithm requires to solve a problem, usually measured in terms of the amount of storage required."
What is the difference between time complexity and space complexity?,"Time complexity measures the speed of an algorithm, while space complexity measures the memory resources required by an algorithm."
What is Big O notation?,Big O notation is a way of expressing the time complexity of an algorithm in terms of the size of the input.
What is the worst-case time complexity of an algorithm?,The worst-case time complexity of an algorithm is the time it takes to solve the problem using the algorithm with the largest input size.
What is the best-case time complexity of an algorithm?,The best-case time complexity of an algorithm is the time it takes to solve the problem using the algorithm with the smallest input size.
What is the average-case time complexity of an algorithm?,The average-case time complexity of an algorithm is the time it takes to solve the problem using an algorithm with a randomly chosen input size.
"What is the difference between worst-case, best-case, and average-case time complexity?","Worst-case time complexity is based on the largest input size, best-case time complexity is based on the smallest input size, and average-case time complexity is based on a randomly chosen input size."
How can we measure the time complexity of an algorithm?,We can measure the time complexity of an algorithm by counting the number of instructions executed by the algorithm for a given input size.
What is the notation for worst-case time complexity?,The notation for worst-case time complexity is O.
What is the meaning of O(1)?,"O(1) means that the algorithm takes a constant amount of time to solve the problem, regardless of the size of the input."
What is the meaning of O(n)?,O(n) means that the algorithm takes time proportional to the size of the input to solve the problem.
What is the meaning of O(n^2)?,O(n^2) means that the algorithm takes time proportional to the square of the size of the input to solve the problem.
What is the meaning of O(log n)?,O(log n) means that the algorithm takes time proportional to the logarithm of the size of the input to solve the problem.
What is the meaning of O(n log n)?,O(n log n) means that the algorithm takes time proportional to the size of the input times the logarithm of the size of the input to solve the problem.
What is the meaning of O(2^n)?,O(2^n) means that the algorithm takes time proportional to 2 raised to the power of the size of the input to solve the problem.
What is the meaning of O(n!)?,O(n!) means that the algorithm takes time proportional to the factorial of the size of the input to solve the problem.
What is the difference between linear and logarithmic time complexity?,"Linear time complexity means that the amount of time the algorithm takes to solve the problem increases directly with the size of the input, while logarithmic time complexity means that the amount of time the algorithm takes to solve the problem increases at a slower rate than the size of the input."
What is the difference between a recursive and iterative algorithm?,"A recursive algorithm is an algorithm that calls itself to solve subproblems, while an iterative algorithm uses loops and other control structures to solve the problem."
What is the difference between a sequential and parallel algorithm?,"A sequential algorithm executes one instruction at a time, while a parallel algorithm executes multiple instructions at the same time."
What is a sort algorithm?,"A sort algorithm is an algorithm designed to arrange a set of data in a specific order, such as alphabetical or numerical order."
What are some common sort algorithms?,"Bubble sort, insertion sort, selection sort, quicksort, and mergesort are some common sort algorithms."
What is the time complexity of bubble sort?,The worst-case time complexity of bubble sort is O(n^2).
What is the time complexity of insertion sort?,The worst-case time complexity of insertion sort is O(n^2).
What is the time complexity of selection sort?,The worst-case time complexity of selection sort is O(n^2).
What is the time complexity of quicksort?,"The worst-case time complexity of quicksort is O(n^2), but its average-case time complexity is O(n log n)."
What is the time complexity of mergesort?,The worst-case time complexity of mergesort is O(n log n).
How does radix sort work?,"Radix sort groups elements into small buckets based on the value of their least significant digit, and then repeats the process with progressively more significant digits until the entire sequence is sorted."
What is the time complexity of radix sort?,"The time complexity of radix sort is O(kn), where k is the number of digits in the largest number."
What is a search algorithm?,A search algorithm is an algorithm designed to find a specific item in a set of data.
What are some common search algorithms?,"Linear search, binary search, and interpolation search are some common search algorithms."
What is the time complexity of linear search?,The worst-case time complexity of linear search is O(n).
What is the time complexity of binary search?,The worst-case time complexity of binary search is O(log n).
What is the time complexity of interpolation search?,"The time complexity of interpolation search is O(log log n) on average, but can be as bad as O(n) in the worst case."
What is a hashing algorithm?,"A hashing algorithm is an algorithm that maps a large amount of data to a smaller value, called a hash, in such a way that it is unlikely two inputs will have the same hash."
What is collision resolution?,Collision resolution is the process by which a hashing algorithm handles situations in which multiple inputs have the same hash value.
What is a heap?,A heap is a data structure that stores a set of items in such a way that we can efficiently extract the item with the highest or lowest priority.
What is a priority queue?,A priority queue is a data structure that stores a set of items in such a way that we can efficiently extract the item with the highest priority.
What is a tree?,A tree is a data structure composed of nodes that are connected by edges.
What is a binary tree?,A binary tree is a tree data structure in which each node has at most two children.
What is a binary search tree?,A binary search tree is a binary tree data structure in which the value of each node is greater than or equal to the values of its left subtree and less than or equal to the values of its right subtree.
What is a balanced tree?,A balanced tree is a tree data structure in which the height of the left and right subtrees of any node differ by at most one.
What is a red-black tree?,"A red-black tree is a binary search tree in which each node is colored black or red, and the color of any node's children must differ from its own color."
What is a hash tree?,"A hash tree, also known as a Merkle tree, is a tree data structure in which each leaf node contains the hash value of a data block, and each non-leaf node contains the hash value of its child nodes."
What is a graph?,"A graph is a data structure composed of nodes, called vertices, that are connected by edges."
What is a directed graph?,A directed graph is a graph in which the edges have a direction or orientation.
What is an undirected graph?,An undirected graph is a graph in which the edges do not have a direction or orientation.
What is a weighted graph?,"A weighted graph is a graph in which edges have a numerical weight, representing the cost or distance between two vertices."
What is a cycle in a graph?,"A cycle in a graph is a sequence of vertices and edges that begins and ends at the same vertex, and that does not repeat any vertices or edges."
What is the shortest path problem?,The shortest path problem is the problem of finding the path with the lowest possible weight between two vertices in a graph.
What is Dijkstra's algorithm?,Dijkstra's algorithm is a graph search algorithm that solves the shortest path problem in a weighted graph with non-negative edge weights.
What is the time complexity of Dijkstra's algorithm?,"The time complexity of Dijkstra's algorithm is O(|E| + |V| log |V|), where E is the set of edges and V is the set of vertices in the graph."
What is the Bellman-Ford algorithm?,The Bellman-Ford algorithm is a graph search algorithm that solves the shortest path problem in a weighted graph with negative edge weights.
What is the time complexity of the Bellman-Ford algorithm?,"The time complexity of the Bellman-Ford algorithm is O(|V||E|), where E is the set of edges and V is the set of vertices in the graph."
What is the Floyd-Warshall algorithm?,The Floyd-Warshall algorithm is an algorithm for finding the shortest paths in a weighted graph with positive and negative edge weights.
What is the time complexity of the Floyd-Warshall algorithm?,"The time complexity of the Floyd-Warshall algorithm is O(|V|^3), where V is the set of vertices in the graph."
What is a minimum spanning tree?,A minimum spanning tree is a spanning tree of a weighted undirected graph that has the lowest possible total weight.
What is Kruskal's algorithm?,"Kruskal's algorithm is a greedy algorithm that finds a minimum spanning tree for a connected, undirected graph."
What is the time complexity of Kruskal's algorithm?,"The time complexity of Kruskal's algorithm is O(|E| log |V|), where E is the set of edges and V is the set of vertices in the graph."
What is Prim's algorithm?,"Prim's algorithm is a greedy algorithm that finds a minimum spanning tree for a connected, undirected graph."
What is the time complexity of Prim's algorithm?,"The time complexity of Prim's algorithm is O(|E| log |V|), where E is the set of edges and V is the set of vertices in the graph."
What is dynamic programming?,Dynamic programming is a technique for solving problems by breaking them down into subproblems and storing the solutions to those subproblems to avoid redundant computations.
What kind of problems is dynamic programming well-suited for?,Dynamic programming is well-suited for problems that exhibit overlapping subproblems and can be broken down into smaller subproblems.
What is the Fibonacci sequence?,"The Fibonacci sequence is a sequence of numbers in which each number is the sum of the two preceding numbers, starting with 0 and 1."
How can we calculate the Fibonacci sequence using dynamic programming?,We can calculate the Fibonacci sequence using dynamic programming by storing the values of previous calculations in an array or table and using those values to calculate the next value in the sequence.
What is the knapsack problem?,The knapsack problem is the problem of finding the most valuable combination of items that can be carried in a knapsack with a limited weight capacity.
How can we solve the knapsack problem using dynamic programming?,We can solve the knapsack problem using dynamic programming by breaking it down into smaller subproblems and building up to the solution using a table or array.
What is memoization?,Memoization is a technique for optimizing recursive algorithms by storing the results of previous computations and reusing them when possible.
What is backtracking?,"Backtracking is a technique for solving problems by exploring all possible solutions and ""backtracking"" to try different paths when one path leads to a dead end."
What is a brute-force algorithm?,"A brute-force algorithm is an algorithm that tries every possible solution to a problem, without regard for efficiency or optimization."
What is a greedy algorithm?,"A greedy algorithm is an algorithm that makes locally optimal choices at each step, with the hope that the globally optimal solution will be reached."
What is a divide-and-conquer algorithm?,"A divide-and-conquer algorithm is an algorithm that breaks a problem down into smaller subproblems, solves those subproblems recursively, and combines the solutions into a single solution to the original problem."
What is recursion?,"Recursion is the process of solving a problem by breaking it down into smaller instances of the same problem, and continuing in a recursive manner until a base case is reached."
What is convergence?,Convergence is the process by which an iterative algorithm approaches a fixed point or stable equilibrium.
What is divergence?,Divergence is the process by which an iterative algorithm moves away from a fixed point or stable equilibrium.
What is an outlier?,An outlier is a data point that differs significantly from other data points.
What is clustering?,Clustering is the process of grouping similar data points together.
What is data compression?,Data compression is the process of reducing the size of data files by encoding them in a more efficient manner.
What is Huffman coding?,"Huffman coding is a data compression technique that uses variable-length codes to represent data, with the shortest codes assigned to frequently occurring data."
What is RLE compression?,RLE compression is a data compression technique that replaces runs of repeating data with a single symbol and a count of how many times the symbol is repeated.
What is LZW compression?,LZW compression is a data compression technique that replaces repeated sequences of data with a single symbol that represents the sequence.
What is the difference between lossless and lossy compression?,"Lossless compression is a type of data compression that preserves all of the original data, while lossy compression is a type of data compression that sacrifices some amount of data in order to achieve a higher compression ratio."
What is wavelet compression?,"Wavelet compression is a data compression technique that analyzes data at various scales and resolutions, and discards the least important information in order to achieve compression."
What is data encryption?,Data encryption is the process of transforming data in such a way that it cannot be read by anyone who does not have access to a specific key or password.
What is symmetric encryption?,Symmetric encryption is a type of encryption in which the same key is used to encrypt and decrypt data.
What is asymmetric encryption?,Asymmetric encryption is a type of encryption in which different keys are used to encrypt and decrypt data.
What is a public key?,"A public key is a key that is used for asymmetric encryption, and that can be freely distributed and used by anyone to encrypt data."
What is a private key?,"A private key is a key that is used for asymmetric encryption, and that must be kept secret in order to decrypt data."
What is a hash function?,A hash function is a function that takes an input data of arbitrary length and produces a fixed-length output.
What are some common uses of hash functions?,"Hash functions are used for data integrity checks, password storage and verification, and data indexing and lookup."
What is a checksum?,"A checksum is a value that is calculated from the contents of a data file, and that can be used to verify that the file has not been corrupted or tampered with."
What is a digital signature?,A digital signature is a digital code that can be added to a message or document to verify that it has not been altered and that the sender is who they claim to be.
What is a symmetric key algorithm?,A symmetric key algorithm is a type of encryption algorithm in which the same key is used to encrypt and decrypt data.
What is a block cipher?,A block cipher is a symmetric key algorithm that encrypts data in fixed-sized blocks.
What is a stream cipher?,A stream cipher is a symmetric key algorithm that encrypts data one bit or byte at a time.
What is the Advanced Encryption Standard (AES)?,The Advanced Encryption Standard (AES) is a widely used block cipher algorithm designed to be efficient and secure.
What is the Data Encryption Standard (DES)?,The Data Encryption Standard (DES) is an older block cipher algorithm that has been largely replaced by AES.
What is the Rivest-Shamir-Adleman (RSA) encryption algorithm?,The Rivest-Shamir-Adleman (RSA) encryption algorithm is a widely used asymmetric encryption algorithm that enables secure communication over an insecure network.
What is the Diffie-Hellman key exchange algorithm?,The Diffie-Hellman key exchange algorithm is a method for two parties to establish a shared secret key over an insecure network.
What is a hash collision?,A hash collision is a situation in which two different inputs produce the same hash value.
Why are hash collisions a concern for hash functions?,"Hash collisions can lead to incorrect data verification or lookup, and can potentially be exploited by attackers to access or modify data."
How can hash collisions be prevented?,"Hash collisions can be prevented by using stronger hash functions, or by using additional algorithms such as salt and pepper to increase the randomness of the input."
What is the birthday attack?,"The birthday attack is a type of attack in which an attacker attempts to find two inputs that produce the same hash value, using the probability of collisions to their advantage."
What is a rainbow table?,"A rainbow table is a precomputed database of hash values and their associated inputs, used to quickly look up the input for a given hash without having to compute it."
How can a rainbow table attack be prevented?,"A rainbow table attack can be prevented by using a stronger hash function or by adding a random ""salt"" value to the input before hashing it."
What is the traveling salesman problem?,The traveling salesman problem is the problem of finding the shortest possible route that visits each of a given set of cities exactly once and returns to the starting city.
What is the knapsack problem?,The knapsack problem is the problem of finding the most valuable combination of items that can be carried in a knapsack with a limited weight capacity.
What is the longest common subsequence problem?,The longest common subsequence problem is the problem of finding the longest sequence of characters that appears in two or more strings.
What is the longest increasing subsequence problem?,The longest increasing subsequence problem is the problem of finding the longest sequence of numbers in a given set that are in increasing order.
What is the stable marriage problem?,The stable marriage problem is
What is a sorting algorithm?,A sorting algorithm is a set of instructions that can arrange a group of items in a particular order.
Why do we need sorting algorithms?,"We need sorting algorithms to arrange data in a meaningful and useful way that can help us analyze, search and process information more efficiently."
What are the different types of sorting algorithms?,"There are many types of sorting algorithms, including Bubble Sort, Insertion Sort, Merge Sort, Quick Sort, Selection Sort, and more."
What is Bubble sort?,"Bubble sort is a simple sorting algorithm that repeatedly steps through the elements of an array, compares adjacent elements and swaps them if they are in the wrong order."
What is Insertion sort?,"Insertion sort is a simple sorting algorithm that builds the final sorted array one item at a time. It places each element in its proper position in the final sorted array, moving the other elements aside if necessary."
What is Merge sort?,"Merge sort is a divide-and-conquer algorithm that divides an array into two halves, sorts each half, and then merges the sorted halves back together."
What is Quick sort?,"Quick sort is a divide-and-conquer algorithm that selects a pivot element, partitions the other elements into two sub-arrays based on whether they are less than or greater than the pivot, and then recursively sorts the two sub-arrays."
What is Selection sort?,"Selection sort is a simple sorting algorithm that selects the smallest or largest element from an unsorted array, swaps it with the element at the beginning of the array, and repeats this process until the array is sorted."
What is Radix sort?,Radix sort is a non-comparative sorting algorithm that sorts data with integer keys by grouping the keys by individual digits that share the same significant position and sorting the data according to these digit groups.
What is Counting sort?,Counting sort is a non-comparative sorting algorithm that sorts data with integer keys by counting the number of occurrences of each distinct element and then using arithmetic to determine the size and location of each element in the sorted sequence.
What is Bucket sort?,"Bucket sort is a non-comparative sorting algorithm that sorts data by distributing it into a number of ""buckets,"" each of which is then sorted either with another sorting algorithm or by recursively applying the bucket sort algorithm itself."
What is Heap sort?,"Heap sort is a comparison-based sorting algorithm that sorts data by creating a binary heap, removing the largest or smallest element from the heap, and rebuilding the heap until all items have been removed."
What is Shell sort?,"Shell sort is a sorting algorithm that uses a gap sequence to arrange elements into several sub-lists, which are then sorted using insertion sort."
What is Cocktail sort?,"Cocktail sort is a variation of bubble sort that sorts an array in both directions, from the beginning to the end and from the end to the beginning."
What is Gnome sort?,"Gnome sort is a simple, comparison-based sorting algorithm that sorts an array by repeatedly moving large values to their correct position."
What is Odd-Even sort?,Odd-Even sort is a sorting algorithm that sorts an array by repeatedly comparing and swapping neighboring elements that are either both odd or both even.
What is Pancake sort?,Pancake sort is a sorting algorithm that sorts an array by repeatedly flipping subarrays of increasing size to bring the largest element to the beginning of the array.
What is Stooge sort?,"Stooge sort is a recursive sorting algorithm that sorts an array by recursively sorting the first 2/3 of the array, the last 2/3 of the array, and then the first 2/3 of the array again."
What is Bogo sort?,"Bogo sort is a ""joke"" sorting algorithm that sorts an array by randomly shuffling it until it happens to be sorted."
What is Pigeonhole sort?,"Pigeonhole sort is a sorting algorithm that works by distributing the elements into a set of ""pigeonholes"" and arranging them in the holes according to a key sequence."
What is the time complexity of Bubble sort?,The time complexity of Bubble sort is O(n^2).
What is the time complexity of Insertion sort?,The time complexity of Insertion sort is O(n^2).
What is the time complexity of Merge sort?,The time complexity of Merge sort is O(n log(n)).
What is the time complexity of Quick sort?,The time complexity of Quick sort is O(n log(n)) on average and O(n^2) in the worst case.
What is the time complexity of Selection sort?,The time complexity of Selection sort is O(n^2).
What is the time complexity of Radix sort?,"The time complexity of Radix sort is O(kn), where k is the number of digits in the largest number."
What is the time complexity of Counting sort?,"The time complexity of Counting sort is O(n+k), where k is the largest element in the array."
What is the time complexity of Bucket sort?,"The time complexity of Bucket sort is O(n+k), where k is the number of buckets, assuming that the elements in each bucket are sorted using another sorting algorithm."
What is the time complexity of Heap sort?,The time complexity of Heap sort is O(n log(n)).
What is the time complexity of Shell sort?,"The time complexity of Shell sort depends on the gap sequence used. A popular gap sequence is the Knuth sequence, which has a worst-case time complexity of O(n^(3/2))."
What is the time complexity of Cocktail sort?,The time complexity of Cocktail sort is O(n^2).
What is the time complexity of Gnome sort?,The time complexity of Gnome sort is O(n^2).
What is the time complexity of Odd-Even sort?,The time complexity of Odd-Even sort is O(n^2).
What is the time complexity of Pancake sort?,The time complexity of Pancake sort is O(n^2).
What is the time complexity of Stooge sort?,The time complexity of Stooge sort is O(n^(log3/log1.5)).
What is the time complexity of Bogo sort?,The time complexity of Bogo sort is O((n+1)!) on average.
What is the time complexity of Pigeonhole sort?,"The time complexity of Pigeonhole sort is O(n+k), where k is the range of the key values."
How do we determine the efficiency of a sorting algorithm?,"We can determine the efficiency of a sorting algorithm by analyzing its time complexity, space complexity, and performance on various inputs."
What is a stable sorting algorithm?,A stable sorting algorithm is an algorithm that preserves the relative order of equal elements in the input array.
